Código,Cuenta,Nivel,Primer Nivel,COMPLETO
126990499,Construcciones en proceso de otros bienes de infraestructura y de beneficio y uso público,6,ACTIVO,TODO
1269908,Bienes intangibles en proceso de producción,5,ACTIVO,TODO
126990803,Producción en proceso de software y programas,6,ACTIVO,TODO
126990899,Producción en proceso de otros bienes intangibles,6,ACTIVO,TODO
127,Inversiones patrimoniales - Método de participación,3,ACTIVO,TODO
12701,Inversiones patrimoniales en el sector privado interno,4,ACTIVO,TODO
1270101,Inversiones patrimoniales en empresas privadas,5,ACTIVO,TODO
127010100,Inversiones patrimoniales en empresas privadas,6,ACTIVO,TODO
1270199,Inversiones patrimoniales en otras unidades del sector privado,5,ACTIVO,TODO
127019900,Inversiones patrimoniales en otras unidades del sector privado,6,ACTIVO,TODO
12702,Inversiones patrimoniales en el sector público interno,4,ACTIVO,TODO
1270201,Inversiones patrimoniales en el Gobierno Central,5,ACTIVO,TODO
127020100,Inversiones patrimoniales en el Gobierno Central,6,ACTIVO,TODO
1270202,Inversiones patrimoniales en Órganos Desconcentrados,5,ACTIVO,TODO
127020200,Inversiones patrimoniales en Órganos Desconcentrados,6,ACTIVO,TODO
1270203,Inversiones patrimoniales en Instituciones Descentralizadas no Empresariales,5,ACTIVO,TODO
127020300,Inversiones patrimoniales en Instituciones Descentralizadas no Empresariales,6,ACTIVO,TODO
1270204,Inversiones patrimoniales en Gobiernos Locales,5,ACTIVO,TODO
127020400,Inversiones patrimoniales en Gobiernos Locales,6,ACTIVO,TODO
1270205,Inversiones patrimoniales en Empresas Públicas no Financieras,5,ACTIVO,TODO
127020500,Inversiones patrimoniales en Empresas Públicas no Financieras,6,ACTIVO,TODO
1270206,Inversiones patrimoniales en Instituciones Públicas Financieras,5,ACTIVO,TODO
127020600,Inversiones patrimoniales en Instituciones Públicas Financieras,6,ACTIVO,TODO
1270299,Inversiones patrimoniales en otras Instituciones de Gobiernos Locales,5,ACTIVO,TODO
127029900,Inversiones patrimoniales en otras Instituciones de Gobiernos Locales,6,ACTIVO,TODO
12703,Inversiones patrimoniales en el sector externo,4,ACTIVO,TODO
1270301,Aportes a organismos internacionales,5,ACTIVO,TODO
127030100,Aportes a organismos internacionales,6,ACTIVO,TODO
1270399,Inversiones patrimoniales en otras unidades del sector externo,5,ACTIVO,TODO
127039900,Inversiones patrimoniales en otras unidades del sector externo,6,ACTIVO,TODO
12704,Inversiones patrimoniales en fideicomisos,4,ACTIVO,TODO
1270401,Inversiones patrimoniales en fideicomisos para obras l/p,5,ACTIVO,TODO
127040100,Inversiones patrimoniales en fideicomisos para obras l/p,6,ACTIVO,TODO
1270402,Inversiones patrimoniales en fideicomisos para la producción l/p,5,ACTIVO,TODO
127040200,Inversiones patrimoniales en fideicomisos para la producción l/p,6,ACTIVO,TODO
1270403,Inversiones patrimoniales en fideicomisos para educación l/p,5,ACTIVO,TODO
127040300,Inversiones patrimoniales en fideicomisos para educación l/p,6,ACTIVO,TODO
1270499,Inversiones patrimoniales en otros fideicomisos l/p,5,ACTIVO,TODO
127049900,Inversiones patrimoniales en otros fideicomisos l/p,6,ACTIVO,TODO
129,Otros activos a largo plazo,3,ACTIVO,TODO
12901,Gastos a devengar a largo plazo,4,ACTIVO,TODO
1290101,Servicios a devengar l/p,5,ACTIVO,TODO
129010101,Primas y gastos de seguros a devengar l/p,6,ACTIVO,TODO
129010102,Alquileres y derechos sobre bienes a devengar l/p,6,ACTIVO,TODO
129010103,Reparaciones y mejoras sobre inmuebles de terceros arrendados l/p,6,ACTIVO,TODO
129010199,Otros servicios a devengar l/p,6,ACTIVO,TODO
1290199,Otros gastos a devengar l/p,5,ACTIVO,TODO
129019999,Otros gastos varios a devengar l/p,6,ACTIVO,TODO
12903,Objetos de valor,4,ACTIVO,TODO
1290301,Piedras y metales preciosos,5,ACTIVO,TODO
129030101,Oro,6,ACTIVO,TODO
129030102,Diamante,6,ACTIVO,TODO
129030199,Otras piedras y metales preciosos,6,ACTIVO,TODO
1290302,Obras de arte y antigüedades,5,ACTIVO,TODO
129030201,Pinturas,6,ACTIVO,TODO
129030202,Esculturas,6,ACTIVO,TODO
129030299,Otras obras de arte y antigüedades,6,ACTIVO,TODO
1290399,Otros objetos de valor,5,ACTIVO,TODO
129039901,Joyas,6,ACTIVO,TODO
129039999,Otros objetos de valor diversos,6,ACTIVO,TODO
12999,Activos a largo plazo sujetos a depuración contable,4,ACTIVO,TODO
1299902,Inversiones a largo plazo sujetas a depuración,5,ACTIVO,TODO
129990201,Títulos y valores a valor razonable a largo plazo sujetos a depuración,6,ACTIVO,TODO
129990202,Títulos y valores a costo amortizado a largo plazo sujetos a depuración,6,ACTIVO,TODO
129990203,Instrumentos derivados a largo plazo sujetos a depuración,6,ACTIVO,TODO
129990299,Otras inversiones financieras a largo plazo sujetas a depuración,6,ACTIVO,TODO
1299903,Cuentas a ca largo plazo sujetas a depuración,5,ACTIVO,TODO
129990303,Ventas a ca largo plazo sujetas a depuración,6,ACTIVO,TODO
129990307,Préstamos a largo plazo sujetos a depuración,6,ACTIVO,TODO
129990308,Documentos a cobrar a largo plazo sujetos a depuración,6,ACTIVO,TODO
129990309,Anticipos a largo plazo sujetos a depuración,6,ACTIVO,TODO
129990310,Deudores por avales a largo plazo sujetos a depuración,6,ACTIVO,TODO
129990399,Otras cuentas a cobrar a largo plazo sujetas a depuración,6,ACTIVO,TODO
1299905,Bienes no concesionados sujetos a depuración,5,ACTIVO,TODO
129990501,"Propiedades, planta y equipos explotados sujetos a depuración",6,ACTIVO,TODO
129990502,Propiedades de inversión sujetas a depuración,6,ACTIVO,TODO
129990503,Activos biológicos sujetos a depuración,6,ACTIVO,TODO
129990504,Bienes de infraestructura y de beneficio y uso público en servicio sujetos a depuración,6,ACTIVO,TODO
129990505,Bienes históricos y culturales sujetos a depuración,6,ACTIVO,TODO
129990506,Recursos naturales en explotación sujetos a depuración,6,ACTIVO,TODO
129990507,Recursos naturales en conservación sujetos a depuración,6,ACTIVO,TODO
129990508,Bienes intangibles sujetos a depuración,6,ACTIVO,TODO
129990599,Bienes en proceso de producción sujetos a depuración,6,ACTIVO,TODO
1299906,Bienes concesionados sujetos a depuración,5,ACTIVO,TODO
129990601,"Propiedades, planta y equipos explotados sujetos a depuración",6,ACTIVO,TODO
129990603,Activos biológicos sujetos a depuración,6,ACTIVO,TODO
129990604,Bienes de infraestructura y de beneficio y uso público en servicio sujetos a depuración,6,ACTIVO,TODO
129990606,Recursos naturales en explotación sujetos a depuración,6,ACTIVO,TODO
129990608,Bienes intangibles sujetos a depuración,6,ACTIVO,TODO
129990699,Bienes en proceso de producción sujetos a depuración,6,ACTIVO,TODO
1299907,Inversiones patrimoniales sujetas a depuración,5,ACTIVO,TODO
129990701,Inversiones patrimoniales en el sector privado interno sujetas a depuración,6,ACTIVO,TODO
129990702,Inversiones patrimoniales en el sector público interno sujetas a depuración,6,ACTIVO,TODO
129990703,Inversiones patrimoniales en el sector externo sujetas a depuración,6,ACTIVO,TODO
129990704,Inversiones patrimoniales en fideicomisos sujetas a depuración,6,ACTIVO,TODO
1299999,Otros activos a largo plazo sujetos a depuración,5,ACTIVO,TODO
129999901,Gastos a devengar sujetos a depuración,6,ACTIVO,TODO
129999902,Objetos de valor sujetos a depuración,6,ACTIVO,TODO
2,PASIVO,1,PASIVO,TODO
21,Pasivo Corriente,2,PASIVO,TODO
211,Deudas a corto plazo,3,PASIVO,TODO
21101,Deudas comerciales a corto plazo,4,PASIVO,TODO
2110101,Deudas por adquisición de inventarios c/p,5,PASIVO,TODO
211010101,Deudas comerciales por adquisición de materiales y suministros para consumo y prestación de servicios c/p,6,PASIVO,TODO
211010102,Deudas comerciales por adquisición de bienes para la venta c/p,6,PASIVO,TODO
211010103,Deudas comerciales por adquisición de materias primas y bienes en producción c/p,6,PASIVO,TODO
211010104,Deudas comerciales por adquisición de bienes para transferir ó donar,6,PASIVO,TODO
2110102,Deudas por adquisición de bienes distintos de inventarios c/p,5,PASIVO,TODO
211010201,"Deudas comerciales por adquisición de propiedades, planta y equipos en explotación c/p",6,PASIVO,TODO
211010202,Deudas comerciales por adquisición de propiedades de inversión c/p,6,PASIVO,TODO
211010203,Deudas comerciales por adquisición de activos biológicos c/p,6,PASIVO,TODO
211010204,Deudas comerciales por adquisición de bienes de infraestructura y de beneficio y uso público c/p,6,PASIVO,TODO
211010205,Deudas comerciales por adquisición de bienes históricos y culturales c/p,6,PASIVO,TODO
211010208,Deudas comerciales por adquisición de bienes intangibles c/p,6,PASIVO,TODO
2110103,Deudas con contratistas por obras de bienes en proceso de producción c/p,5,PASIVO,TODO
211010301,"Deudas con contratistas por obras en propiedades, planta y equipos c/p",6,PASIVO,TODO
211010302,Deudas con contratistas por obras en propiedades de inversión c/p,6,PASIVO,TODO
211010304,Deudas con contratistas por obras en bienes de infraestructura y de beneficio y uso público c/p,6,PASIVO,TODO
211010305,Deudas con contratistas por obras en bienes culturales c/p,6,PASIVO,TODO
211010308,Deudas con contratistas por producción de bienes intangibles c/p,6,PASIVO,TODO
211010309,Deudas con contratistas por producción de obras a terceros c/p,6,PASIVO,TODO
2110104,Deudas por adquisición de servicios c/p,5,PASIVO,TODO
211010401,Deudas comerciales por alquileres y derechos sobre bienes c/p,6,PASIVO,TODO
211010402,Deudas comerciales por servicios básicos c/p,6,PASIVO,TODO
211010403,Deudas comerciales por servicios comerciales y financieros c/p,6,PASIVO,TODO
211010404,Deudas comerciales por servicios de gestión y apoyo c/p,6,PASIVO,TODO
211010405,Deudas comerciales por gastos de viaje y transporte c/p,6,PASIVO,TODO
211010406,"Deudas comerciales por seguros, reaseguros y otras obligaciones c/p",6,PASIVO,TODO
211010407,Deudas comerciales por capacitación y protocolo c/p,6,PASIVO,TODO
211010408,Deudas comerciales por mantenimiento y reparaciones c/p,6,PASIVO,TODO
211010499,Deudas comerciales por otros servicios c/p,6,PASIVO,TODO
2110105,Arrendamientos financieros a pagar c/p,5,PASIVO,TODO
211010501,"Arrendamientos financieros de propiedades, planta y equipos a pagar c/p",6,PASIVO,TODO
211010502,Arrendamientos financieros de propiedades de inversión a pagar c/p,6,PASIVO,TODO
211010508,Arrendamientos financieros de bienes intangibles a pagar c/p,6,PASIVO,TODO
2110106,Deudas Comerciales a proveedores,5,PASIVO,TODO
211010601,Deudas comerciales proveedores nacionales,6,PASIVO,TODO
211010602,Deudas comerciales proveedores extranjeros,6,PASIVO,TODO
211010603,Deudas comerciales acredores institucionales,6,PASIVO,TODO
211010604,Deudas comerciales acredores ocacionales,6,PASIVO,TODO
211010605,Deudas comerciales acredores internacionales,6,PASIVO,TODO
211010606,Deuda comercial Orden de Pago Asamblea Legislativa,6,PASIVO,TODO
211010607,Deuda comerciales Ordenes de Pago CGR,6,PASIVO,TODO
211010608,Deuda comercial Orden Pago Defensoria Habitantes,6,PASIVO,TODO
211010609,Deuda comerciales Ordenes de Pago Poder Judicial,6,PASIVO,TODO
211010610,Deuda comerciales acredores Empleados,6,PASIVO,TODO
211010611,Deuda comerciales Ordenes de Pago Ministerios,6,PASIVO,TODO
211010612,Deuda comerciales Ordenes de Pago Otras Instituciones,6,PASIVO,TODO
211010613,Deuda comerciales Ordenes de Pago Poderes,6,PASIVO,TODO
2110107,Deudas Comerciales Recepcion de Mercaderia,5,PASIVO,TODO
211010701,Recepcion de Mercaderia y Servicios,6,PASIVO,TODO
211010702,Impuesto al Valor Agregado ( MM ),6,PASIVO,TODO
21102,Deudas sociales y fiscales a corto plazo,4,PASIVO,TODO
2110201,Deudas por beneficios a los empleados c/p,5,PASIVO,TODO
211020101,Remuneraciones básicas y eventuales a pagar c/p,6,PASIVO,TODO
211020103,Incentivos salariales a pagar c/p,6,PASIVO,TODO
211020104,Contribuciones patronales al desarrollo y la seguridad social a pagar c/p,6,PASIVO,TODO
211020105,Contribuciones patronales a fondos de pensiones y a otros fondos de capitalización a pagar c/p,6,PASIVO,TODO
211020106,Retenciones al personal a pagar c/p,6,PASIVO,TODO
211020107,Asistencia social y beneficios al personal a pagar c/p,6,PASIVO,TODO
211020108,Deducciones al salario escolar,6,PASIVO,TODO
211020109,Contribuciones estatales al desarrollo y la seguridad social a pagar c/p,6,PASIVO,TODO
211020199,Otros deudas por beneficios a los empleados c/p,6,PASIVO,TODO
2110202,Deudas fiscales c/p,5,PASIVO,TODO
211020201,"Impuestos, multas y recargos moratorios a pagar c/p",6,PASIVO,TODO
211020202,Retenciones de impuestos nacionales a pagar c/p,6,PASIVO,TODO
211020203,Retenciones de impuestos municipales a pagar c/p,6,PASIVO,TODO
211020204,Retenciones de impuestos entidades relacionadas a pagar c/p,6,PASIVO,TODO
211020205,Impuesto sobre la renta a pagar,6,PASIVO,TODO
2110203,Deudas por beneficios a los empleados por terminacion laboral c/p,5,PASIVO,TODO
211020301,Deudas por cesantia a beneficio de los empleados,6,PASIVO,TODO
211020302,Deudas por cesantia administrada por entidades privadas,6,PASIVO,TODO
21103,Transferencias a pagar a corto plazo,4,PASIVO,TODO
2110301,Transferencias al sector privado interno a pagar c/p,5,PASIVO,TODO
211030101,Transferencias a personas a pagar c/p,6,PASIVO,TODO
211030102,Transferencias a entidades del sector privado interno a pagar c/p,6,PASIVO,TODO
2110302,Transferencias al sector público interno a pagar c/p,5,PASIVO,TODO
211030201,Transferencias al Gobierno Central a pagar c/p,6,PASIVO,TODO
211030202,Transferencias a Órganos Desconcentrados a pagar c/p,6,PASIVO,TODO
211030203,Transferencias a Instituciones Descentralizadas no Empresariales a pagar c/p,6,PASIVO,TODO
211030204,Transferencias a Gobiernos Locales a pagar c/p,6,PASIVO,TODO
211030205,Transferencias a Empresas Públicas no Financieras a pagar c/p,6,PASIVO,TODO
211030206,Transferencias a Instituciones Públicas Financieras a pagar c/p,6,PASIVO,TODO
211030299,Transferencias a otras Instituciones de Gobiernos Locales a pagar c/p,6,PASIVO,TODO
2110303,Transferencias al sector externo a pagar c/p,5,PASIVO,TODO
211030301,Transferencias a gobiernos extranjeros a pagar c/p,6,PASIVO,TODO
211030302,Transferencias a organismos internacionales a pagar c/p,6,PASIVO,TODO
211030399,Transferencias a otras unidades del Sector Externo a pagar c/p,6,PASIVO,TODO
21104,Documentos a pagar a corto plazo,4,PASIVO,TODO
2110401,Documentos a pagar por adquisición de inventarios c/p,5,PASIVO,TODO
211040101,Documentos a pagar por adquisición de materiales y suministros para consumo y prestación de servicios c/p,6,PASIVO,TODO
211040102,Documentos a pagar por adquisición de bienes para la venta c/p,6,PASIVO,TODO
211040103,Documentos a pagar por adquisición de materias primas y bienes en producción c/p,6,PASIVO,TODO
2110402,Documentos a pagar por adquisición de bienes distintos de inventarios c/p,5,PASIVO,TODO
211040201,"Documentos a pagar por adquisición de propiedades, planta y equipos c/p",6,PASIVO,TODO
211040202,Documentos a pagar por adquisición de propiedades de inversión c/p,6,PASIVO,TODO
211040203,Documentos a pagar por adquisición de activos biológicos c/p,6,PASIVO,TODO
211040204,Documentos a pagar por adquisición de bienes de infraestructura y de beneficio y uso público c/p,6,PASIVO,TODO
211040205,Documentos a pagar por adquisición de bienes históricos y culturales c/p,6,PASIVO,TODO
211040208,Documentos a pagar por adquisición de bienes intangibles c/p,6,PASIVO,TODO
2110403,Documentos a pagar por obras de bienes en proceso de producción c/p,5,PASIVO,TODO
211040301,"Documentos a pagar por obras en propiedades, planta y equipos c/p",6,PASIVO,TODO
211040302,Documentos a pagar por obras en propiedades de inversión c/p,6,PASIVO,TODO
211040304,Documentos a pagar por obras en bienes de infraestructura y de beneficio y uso público c/p,6,PASIVO,TODO
211040305,Documentos a pagar por obras en bienes culturales c/p,6,PASIVO,TODO
211040308,Documentos a pagar por obras en bienes intangibles c/p,6,PASIVO,TODO
2110404,Documentos a pagar por adquisición de servicios c/p,5,PASIVO,TODO
211040401,Documentos a pagar por alquileres y derechos sobre bienes c/p,6,PASIVO,TODO
211040402,Documentos a pagar por servicios básicos c/p,6,PASIVO,TODO
211040403,Documentos a pagar por servicios comerciales y financieros c/p,6,PASIVO,TODO
211040404,Documentos a pagar por servicios de gestión y apoyo c/p,6,PASIVO,TODO
211040405,Documentos a pagar por gastos de viaje y transporte c/p,6,PASIVO,TODO
211040406,"Documentos a pagar por seguros, reaseguros y otras obligaciones c/p",6,PASIVO,TODO
211040407,Documentos a pagar por capacitación y protocolo c/p,6,PASIVO,TODO
211040408,Documentos a pagar por mantenimiento y reparaciones c/p,6,PASIVO,TODO
211040499,Documentos a pagar por otros servicios c/p,6,PASIVO,TODO
2110405,Documentos a pagar al exterior c/p,5,PASIVO,TODO
211040599,Otros documentos a pagar al exterior c/p,6,PASIVO,TODO
2110499,Otros documentos internos a pagar c/p,5,PASIVO,TODO
211049999,Otros documentos internos varios a pagar c/p,6,PASIVO,TODO
21105,Inversiones patrimoniales a pagar a corto plazo,4,PASIVO,TODO
2110501,Inversiones patrimoniales en el sector privado interno a pagar c/p,5,PASIVO,TODO
211050101,Inversiones patrimoniales en empresas privadas a pagar c/p,6,PASIVO,TODO
211050199,Inversiones patrimoniales en otras unidades del sector privado a pagar c/p,6,PASIVO,TODO
2110502,Inversiones patrimoniales en el sector público interno a pagar c/p,5,PASIVO,TODO
211050201,Inversiones patrimoniales en el Gobierno Central a pagar c/p,6,PASIVO,TODO
211050202,Inversiones patrimoniales en Órganos Desconcentrados a pagar c/p,6,PASIVO,TODO
211050203,Inversiones patrimoniales en Instituciones Descentralizadas no Empresariales a pagar c/p,6,PASIVO,TODO
211050204,Inversiones patrimoniales en Gobiernos Locales a pagar c/p,6,PASIVO,TODO
211050205,Inversiones patrimoniales en Empresas Públicas no Financieras a pagar c/p,6,PASIVO,TODO
211050206,Inversiones patrimoniales en Instituciones Públicas Financieras a pagar c/p,6,PASIVO,TODO
211050299,Inversiones patrimoniales en otras Instituciones de Gobiernos Locales a pagar c/p,6,PASIVO,TODO
2110503,Inversiones patrimoniales en el sector externo a pagar c/p,5,PASIVO,TODO
211050301,Aportes a organismos internacionales a pagar c/p,6,PASIVO,TODO
211050399,Inversiones patrimoniales en otras unidades del sector externo a pagar c/p,6,PASIVO,TODO
2110504,Inversiones patrimoniales en fideicomisos a pagar c/p,5,PASIVO,TODO
211050401,Inversiones patrimoniales en fideicomisos para obras a pagar c/p,6,PASIVO,TODO
211050402,Inversiones patrimoniales en fideicomisos para la producción a pagar c/p,6,PASIVO,TODO
211050403,Inversiones patrimoniales en fideicomisos para educación a pagar c/p,6,PASIVO,TODO
211050499,Inversiones patrimoniales en otros fideicomisos a pagar c/p,6,PASIVO,TODO
21106,Deudas por avales ejecutados a corto plazo,4,PASIVO,TODO
2110602,Deudas con el sector público interno por avales ejecutados c/p,5,PASIVO,TODO
211060201,Deudas con el Gobierno Central por avales ejecutados c/p,6,PASIVO,TODO
211060202,Deudas con Órganos Desconcentrados por avales ejecutados c/p,6,PASIVO,TODO
211060203,Deudas con Instituciones Descentralizadas no Empresariales por avales ejecutados c/p,6,PASIVO,TODO
211060204,Deudas con Gobiernos Locales por avales ejecutados c/p,6,PASIVO,TODO
211060205,Deudas con Empresas Públicas no Financieras por avales ejecutados c/p,6,PASIVO,TODO
211060206,Deudas con Instituciones Públicas Financieras por avales ejecutados c/p,6,PASIVO,TODO
211060299,Deudas con otras Instituciones de Gobiernos Locales por avales ejecutados c/p,6,PASIVO,TODO
2110603,Deudas con el sector externo por avales ejecutados c/p,5,PASIVO,TODO
211060301,Deudas con gobiernos extranjeros por avales ejecutados c/p,6,PASIVO,TODO
211060302,Deudas con organismos financieros internacionales por avales ejecutados c/p,6,PASIVO,TODO
211060399,Otras deudas con el sector externo por avales ejecutados c/p,6,PASIVO,TODO
21107,Deudas por anticipos a corto plazo,4,PASIVO,TODO
2110701,Deudas por anticipos a cuenta de impuestos c/p,5,PASIVO,TODO
211070101,"Deudas por anticipos a cuenta de impuestos sobre los ingresos, las utilidades y las ganancias de capital c/p",6,PASIVO,TODO
211070102,Deudas por anticipos a cuenta de impuestos sobre la propiedad c/p,6,PASIVO,TODO
211070103,Deudas por anticipos a cuenta de impuestos sobre bienes y servicios c/p,6,PASIVO,TODO
211070104,Deudas por anticipos a cuenta de impuestos sobre el comercio exterior y transacciones internacionales c/p,6,PASIVO,TODO
211070199,Deudas por anticipos a cuenta de otros impuestos c/p,6,PASIVO,TODO
2110797,Deudas por otros anticipos del sector privado interno c/p,5,PASIVO,TODO
211079799,Deudas por otros anticipos de otras unidades del sector privado interno c/p,6,PASIVO,TODO
2110798,Deudas por otros anticipos del sector público interno c/p,5,PASIVO,TODO
211079801,Deudas por otros anticipos del Gobierno Central c/p,6,PASIVO,TODO
211079802,Deudas por otros anticipos de Órganos Desconcentrados c/p,6,PASIVO,TODO
211079803,Deudas por otros anticipos de Instituciones Descentralizadas no Empresariales c/p,6,PASIVO,TODO
211079804,Deudas por otros anticipos de Gobiernos Locales c/p,6,PASIVO,TODO
211079805,Deudas por otros anticipos de Empresas Públicas no Financieras c/p,6,PASIVO,TODO
211079806,Deudas por otros anticipos de Instituciones Públicas Financieras c/p,6,PASIVO,TODO
211079899,Deudas por otros anticipos de otras Instituciones de Gobiernos Locales c/p,6,PASIVO,TODO
2110799,Deudas por otros anticipos del sector externo c/p,5,PASIVO,TODO
211079901,Deudas por otros anticipos de gobiernos extranjeros c/p,6,PASIVO,TODO
211079902,Deudas por otros anticipos de organismos internacionales c/p,6,PASIVO,TODO
211079999,Deudas por otros anticipos de otras unidades del sector externo c/p,6,PASIVO,TODO
21108,Deudas por Planillas salariales,4,PASIVO,TODO
2110802,Deudas por Planillas salariales del sector público interno a Pagar c/p,5,PASIVO,TODO
211080201,Deudas del Gobierno Central a Pagar c/p,6,PASIVO,TODO
211080202,Deudas de Órganos Desconcentrados a Pagar c/p,6,PASIVO,TODO
21113,Deudas por Creditos Fiscales a favor de terceros c/p,4,PASIVO,TODO
2111301,Deudas por Creditos Fiscales a favor de terceros c/p,5,PASIVO,TODO
211130101,Deudas por Creditos Fiscales a favor de terceros c/p,6,PASIVO,TODO
21199,Otras deudas a corto plazo,4,PASIVO,TODO
2119999,Deudas varias c/p,5,PASIVO,TODO
211999901,Deudas varias con el sector privado interno c/p,6,PASIVO,TODO
211999902,Deudas varias con el sector público interno c/p,6,PASIVO,TODO
211999903,Deudas varias con el sector externo c/p,6,PASIVO,TODO
212,Endeudamiento público a corto plazo,3,PASIVO,TODO
21201,Títulos y valores de la deuda pública a pagar a corto plazo,4,PASIVO,TODO
2120101,Títulos y valores de la deuda pública interna a pagar c/p,5,PASIVO,TODO
212010101,Títulos y valores de la deuda pública interna a pagar c/p - Capital,6,PASIVO,TODO
212010102,Títulos y valores de la deuda pública interna a pagar c/p - Importes a devengar,6,PASIVO,TODO
212010103,Títulos y valores de la deuda pública interna a pagar c/p - Intereses devengados,6,PASIVO,TODO
212010104,Títulos y valores de la deuda pública interna a pagar c/p - Primas por colocación sobre la par a devengar,6,PASIVO,TODO
212010199,Títulos y valores de la deuda pública interna a pagar c/p - Servicios a pagar,6,PASIVO,TODO
2120102,Títulos y valores de la deuda pública externa a pagar c/p,5,PASIVO,TODO
212010201,Títulos y valores de la deuda pública externa a pagar c/p - Capital,6,PASIVO,TODO
212010202,Títulos y valores de la deuda pública externa a pagar c/p - Importes a devengar,6,PASIVO,TODO
212010203,Títulos y valores de la deuda pública externa a pagar c/p - Intereses devengados,6,PASIVO,TODO
212010204,Títulos y valores de la deuda pública externa a pagar c/p - Primas por colocación sobre la par a devengar,6,PASIVO,TODO
212010299,Títulos y valores de la deuda pública externa a pagar c/p - Servicios a pagar,6,PASIVO,TODO
21202,Préstamos a pagar a corto plazo,4,PASIVO,TODO
2120201,Préstamos del sector privado interno a pagar c/p,5,PASIVO,TODO
212020101,Préstamos de instituciones privadas sin fines de lucro a pagar c/p,6,PASIVO,TODO
212020102,Préstamos de empresas privadas a pagar c/p,6,PASIVO,TODO
212020199,Préstamos de otras unidades del sector privado interno a pagar c/p,6,PASIVO,TODO
2120202,Préstamos del sector público interno a pagar c/p,5,PASIVO,TODO
212020201,Préstamos del Gobierno Central a pagar c/p,6,PASIVO,TODO
212020202,Préstamos de Órganos Desconcentrados a pagar c/p,6,PASIVO,TODO
212020203,Préstamos de Instituciones Descentralizadas no Empresariales a pagar c/p,6,PASIVO,TODO
212020204,Préstamos de Gobiernos Locales a pagar c/p,6,PASIVO,TODO
212020205,Préstamos de Empresas Públicas no Financieras a pagar c/p,6,PASIVO,TODO
212020206,Préstamos de Instituciones Públicas Financieras a pagar c/p,6,PASIVO,TODO
212020299,Préstamos de otras Instituciones de Gobiernos Locales a pagar c/p,6,PASIVO,TODO
2120203,Préstamos del sector externo a pagar c/p,5,PASIVO,TODO
212020301,Préstamos de gobiernos extranjeros a pagar c/p,6,PASIVO,TODO
212020302,Préstamos de organismos financieros internacionales a pagar c/p,6,PASIVO,TODO
212020399,Préstamos de otras entidades del sector externo a pagar c/p,6,PASIVO,TODO
21203,Deudas asumidas a corto plazo,4,PASIVO,TODO
2120301,Deudas asumidas del sector privado interno c/p,5,PASIVO,TODO
212030199,Otras deudas asumidas del sector privado interno c/p,6,PASIVO,TODO
2120302,Deudas asumidas del sector público interno c/p,5,PASIVO,TODO
212030299,Otras deudas asumidas del sector público interno c/p,6,PASIVO,TODO
